{
  "schemaVersion": 1,
  "enabled": true,
  "image": {
    "path": "board-front.png",
    "width": 1102,
    "height": 738,
    "sha256": "f1fa36810bcc6ef2988cdf4ed308d78cf8170600fc555bc9f30697518780da66"
  },
  "display": {
    "x": 5,
    "y": 195,
    "width": 366,
    "height": 366
  },
  "buttons": [
    {
      "id": "userButton",
      "bounds": {
        "x": 490,
        "y": 644,
        "width": 48,
        "height": 48
      }
    }
  ],
  "windowWidth": 1102
}
